{
  "$schema": "https://json-schema.org/draft/2020-12/schema",
  "$id": "https://aoa-routing/mechanics/governance/parts/charter-change-routing/schemas/charter_change_route_v1.json",
  "title": "Charter Change Route V1",
  "type": "object",
  "additionalProperties": false,
  "required": [
    "amendment_ref",
    "authority",
    "created_at",
    "decision_refs",
    "evidence_refs",
    "id",
    "kind",
    "notes",
    "owner_repo",
    "schema_version",
    "status"
  ],
  "properties": {
    "amendment_ref": {
      "type": "string",
      "minLength": 1
    },
    "authority": {
      "type": "object",
      "additionalProperties": false,
      "required": [
        "actor",
        "mode"
      ],
      "properties": {
        "actor": {
          "type": "string",
          "minLength": 1
        },
        "mode": {
          "type": "string",
          "minLength": 1,
          "enum": [
            "reviewed"
          ]
        }
      }
    },
    "created_at": {
      "type": "string",
      "minLength": 1
    },
    "decision_refs": {
      "type": "array",
      "items": {
        "type": "string",
        "minLength": 1
      }
    },
    "evidence_refs": {
      "type": "array",
      "items": {
        "type": "string",
        "minLength": 1
      },
      "minItems": 1
    },
    "id": {
      "type": "string",
      "minLength": 1
    },
    "kind": {
      "type": "string",
      "minLength": 1,
      "const": "routing.charter_change_route"
    },
    "notes": {
      "type": "array",
      "items": {
        "type": "string",
        "minLength": 1
      },
      "minItems": 1
    },
    "owner_repo": {
      "type": "string",
      "minLength": 1
    },
    "schema_version": {
      "type": "string",
      "minLength": 1,
      "const": "v1"
    },
    "status": {
      "type": "string",
      "minLength": 1,
      "enum": [
        "proposed"
      ]
    }
  }
}
