{
  "amendment_ref": "experience.charter_amendment.example.001",
  "authority": {
    "actor": "operator.sovereign",
    "mode": "reviewed"
  },
  "created_at": "2026-04-22T12:00:00-06:00",
  "decision_refs": [],
  "evidence_refs": [
    "receipt:example:001"
  ],
  "id": "routing.charter_change_route.example.001",
  "kind": "routing.charter_change_route",
  "notes": [
    "seed example for v0.8 polis governance"
  ],
  "owner_repo": "aoa-agents",
  "schema_version": "v1",
  "status": "proposed"
}
